image_name,category,true_caption,retrieved_caption,CLIPScore_matched,CLIPScore_retrieved,CLIPScore_random,BERTScore_F1
003686,tvmonitor,Old Compaq tvmonitor displaying Mac OS X,Old Compaq tvmonitor displaying Mac OS X,0.36398202,0.36398202,0.11609304,1.0
n03983396_12459,bottle,Bottle with straw beside a blue wall,Bottle with straw beside a blue wall,0.3764863,0.3764863,0.15637197,1.0
2008_000037,aeroplane,Aeroplane flying high in the clear sky,Aeroplane flying low above grassy airfield,0.29042774,0.32265764,0.129291,0.93540645
2009_000177,train,Train at a modern glass-covered station,Train at a modern glass-covered station,0.31305656,0.31305656,0.15776601,1.0
2009_003241,dog,Dog playing in the snow,Dog playing in the snow,0.2975101,0.2975101,0.1193735,1.0
n02389026_1168,horse,Brown horse standing near a wooden barn,Brown horse standing in a fenced enclosure,0.31944698,0.31945682,0.15414053,0.9396045
2010_003714,horse,Horse running fast across a dusty paddock,Horse running fast across a dusty paddock,0.34081554,0.34081554,0.1567243,1.0
n03983396_14387,bottle,Green Mountain Dew bottle lineup on a shelf,Green Mountain Dew bottle lineup on a shelf,0.3196296,0.3196296,0.13554786,1.0
2009_005031,aeroplane,Aeroplane on airport runway with trees nearby,Silver aeroplane displayed on outdoor tarmac,0.25282615,0.26951954,0.07367805,0.90548176
n11939491_6422,flower,Yellow flower blooming among green leafy plants,Yellow flower blooming among green leaves,0.32746494,0.33276814,0.14723606,0.97275954
000670,person,Two people sitting together indoors,Two people sitting together indoors,0.27974278,0.27974278,0.15377441,1.0
008564,horse,Horse walking on grassy field under blue sky,Horse walking in a fenced grassy area,0.2986946,0.3280764,0.10299305,0.9446535
003166,cat,Cat lounging on a tiled floor indoors,Gray cat indoors with tan walls,0.28050438,0.28811812,0.17605391,0.88501686
2008_004752,dog,Dog standing on a sandy beach,Dog standing on a sandy beach,0.29503557,0.29503557,0.20894575,1.0
n03201208_18434,diningtable,Round diningtable with four wooden chairs,Round diningtable with four wooden chairs,0.34250122,0.34250122,0.19555953,1.0
2010_005433,motorbike,Blue motorbike parked on a driveway,Blue motorbike parked on a driveway,0.33844995,0.33844995,0.14598686,1.0000001
n04483307_2979,boat,Sailboat gliding on calm open water,Boat with tall sails on open water,0.3116486,0.32103246,0.130124,0.9300026
n04152593_63603,tvmonitor,Tvmonitor displaying blue screen beside keyboard setup,tvmonitor on a desk with keyboard and computer,0.2993263,0.33562642,0.15492722,0.8902848
2010_003725,sheep,Sheep standing by a metal fence,Sheep standing in a wire pen,0.29490387,0.30139762,0.1155187,0.95857614
n04483307_10156,boat,Passenger boat approaching a sunny harbor dock,Passenger boat approaching a sunny harbor dock,0.27553385,0.27553385,0.13329256,0.99999994
2009_001537,sheep,Sheep grazing on a grassy hillside,Sheep with large horns on rocky terrain,0.29591843,0.31650886,0.25507268,0.91353166
n02410509_23735,cow,Cow resting beside a rocky road,Cow resting beside a rocky road,0.3189894,0.3189894,0.20437203,1.0
n04152593_44196,tvmonitor,Tvmonitor on office desk with files,Two tvmonitor screens on a cluttered desk,0.29852352,0.32956672,0.14329733,0.9130182
002733,car,White car displayed on a modern showroom floor,White car displayed on a modern showroom floor,0.30841166,0.30841166,0.13158122,1.0
n02835271_24771,bicycle,Yellow tandem bicycle against a brick wall,Bicycle with yellow rims on a red mat,0.32986355,0.3330186,0.12121868,0.8905726
008511,bicycle,Bicycle with bamboo frame near a wall,Bicycle with bamboo frame near a wall,0.31681323,0.31681323,0.13790734,1.0
n03782006_10567,tvmonitor,Rows of old tvmonitor screens on shelves,Rows of old tvmonitor screens on shelves,0.3192761,0.3192761,0.08604133,1.0
n03095699_7497,boat,Container boat sailing on open water,Boat carrying cargo containers on open water,0.29386467,0.31219274,0.13716,0.9388226
n03782006_15613,tvmonitor,Dual tvmonitor screens on a computer desk,Dual tvmonitor screens on a computer desk,0.320193,0.320193,0.12318742,1.0
000946,train,Modern train arriving at covered station platform,Modern train arriving at covered station platform,0.30361062,0.30361062,0.15758559,1.0000001
2010_001240,cat,Cat with green eyes lying on paper,Gray cat indoors with tan walls,0.31622988,0.31899506,0.14532195,0.86903995
006326,car,Silver car parked in a tree-lined lot,Car parked in front of green garage door,0.24050191,0.2645663,0.12722105,0.90526104
n03376595_2809,chair,Striped folding chair on carpeted floor,Striped folding chair on carpeted floor,0.32944614,0.32944614,0.10879502,1.0
n03782006_5705,tvmonitor,tvmonitor on a cluttered wooden desk,Three tvmonitors on a corner desk workspace,0.28564993,0.30404037,0.13860628,0.9042091
2009_005024,train,Train traveling through a rural wooded area,Passenger train approaching through forested tracks,0.28784683,0.30518368,0.13457379,0.929015
n03782006_15631,tvmonitor,Old tvmonitor screens stacked against the wall,Multiple tvmonitors surrounded by old computers,0.3199284,0.3297992,0.14192224,0.90199757
n11939491_42468,flower,Yellow flower with green leafy surroundings,Yellow flower with green and brown center,0.27696326,0.3007668,0.1324953,0.91819835
n11939491_6746,flower,Orange flower with soft green surroundings,Orange flower with soft green surroundings,0.30431196,0.30431196,0.14487621,1.0
n11939491_48844,flower,White flower with yellow center among green leaves,White daisy flower surrounded by green grass,0.3054213,0.33510023,0.19412547,0.90285903
2010_001000,cow,Brown and white cow standing with herd,Two cows harnessed together on farmland,0.27314138,0.29239875,0.24703737,0.88647217
2010_005522,dog,Dog standing on seaweed covered beach sand,Dog standing on seaweed covered beach sand,0.34768042,0.34768042,0.1530468,1.0
n03201208_30028,diningtable,Diningtable with wooden chairs and tiled floor,Diningtable with six chairs on wooden floor,0.3125798,0.34583122,0.13590935,0.955206
n04487081_4029,bus,Orange city bus driving along a leafy street,Bus parked on a paved street plaza,0.28294516,0.30100578,0.12049615,0.91894555
002276,bird,Bird with large beak perched on branch,Colorful bird standing on a wooden branch,0.29344988,0.2950539,0.1369835,0.90759903
n02417914_39371,sheep,Sheep grazing among rocks and bushes,Sheep with large horns on rocky terrain,0.27069962,0.32197016,0.15538107,0.9147688
n03201208_28578,diningtable,Diningtable with red chairs and modern lamps,Diningtable with red chairs and modern lamps,0.27480596,0.27480596,0.13341075,1.0
n04344873_14569,sofa,White sofa with four pillows beside window,White sofa with four pillows beside window,0.30511504,0.30511504,0.12297197,1.0
009681,aeroplane,Aeroplane on grassy field near trees,Aeroplane landing on a grassy runway,0.31580994,0.3303944,0.12471633,0.9514047
n02389026_3388,horse,Young horse standing on green grass,Young horse foal trotting on green grass,0.30607027,0.31147355,0.14414614,0.9546603
n04344873_7228,sofa,Wooden sofa with colorful cushions and pillows,Wooden sofa with colorful cushions and pillows,0.28869832,0.28869832,0.15284799,1.0
2008_008424,aeroplane,Aeroplane taxiing on runway near buildings,Aeroplane taxiing on runway near buildings,0.30690452,0.30690452,0.12189737,1.0
2008_002033,dog,Dog running through water with tennis ball,Dog running through water with tennis ball,0.35244298,0.35244298,0.13758987,1.0
2008_000902,person,Person in a crowd wearing a coat,Person in a crowd wearing a coat,0.29240537,0.29240537,0.16550228,1.0000001
n03791053_10464,motorbike,Motorbike parked by a concrete wall,Motorbike parked on cobblestone sidewalk,0.28252864,0.30786917,0.06262112,0.9296214
n04344873_14637,sofa,White sofa with pillow near glass walls,White sofa with pillow near glass walls,0.33409947,0.33409947,0.13908735,1.0
n03785016_1025,motorbike,Red motorbike parked on a paved walkway,Red motorbike parked on a paved walkway,0.31049964,0.31049964,0.10946749,1.0
n04487081_39774,bus,Bus traveling down a tree-lined street,Bus turning on a street near tall trees,0.3000781,0.31563425,0.13105209,0.9248028
n03095699_21731,boat,Cargo boat loaded with containers on water,Large container boat passing near city shoreline,0.27871072,0.3063839,0.14946306,0.891698
n11939491_11909,flower,White flower with yellow center among green leaves,White daisy flower with green foliage,0.2865929,0.3301038,0.14221178,0.92898595
n02422699_817,sheep,Sheep standing alert in dry grass,Bird standing on grassy ground near bushes,0.22532138,0.27437732,0.12470536,0.90520066
2009_000068,horse,Horse walking on snowy ground near mountains,Horse walking in snowy fenced yard,0.2910878,0.3071711,0.13224155,0.9308596
n04487081_5397,bus,Two city buses on a sunny street,Two city buses on a sunny street,0.30742472,0.30742472,0.20265302,1.0
n03095699_28756,boat,Container boat carrying cargo on calm water,Container boat carrying cargo on calm water,0.3089665,0.3089665,0.14012513,1.0
2008_003984,person,Person with costume accessories against brick wall,Person with costume accessories against brick wall,0.2810591,0.2810591,0.073494576,0.99999994
n03095699_8455,boat,Boat carrying colorful containers on the ocean,Container boat loaded with cargo at sea,0.29321116,0.3278119,0.14886607,0.91706824
007376,bus,Bus driving past tall city buildings,Electric bus on city street with buildings,0.2586456,0.31149396,0.10967981,0.9168753
2008_000464,cat,Cat sitting on a windowsill indoors,Gray cat indoors with tan walls,0.30311474,0.31698355,0.17994179,0.8843337
n04487081_161,bus,Bus turning on a city street with apartments,Bus parked on a paved street plaza,0.30934444,0.3231805,0.11167754,0.9139423
004972,bird,Bird perched on a wire against beige sky,Bird perched on a wire against beige sky,0.29898757,0.29898757,0.089247204,1.0
n04483307_7895,boat,Sailboat gliding on calm water near shore,Boat with tall sails on open water,0.26654834,0.31104732,0.13040626,0.91397905
2009_003913,dog,Dog wearing blue outfit beside red bag,Dog wearing blue outfit beside red bag,0.26394615,0.26394615,0.09382418,0.99999994
2010_000324,person,Person in blue hoodie cooking outdoors,Person in blue hoodie cooking outdoors,0.36313277,0.36313277,0.119017005,1.0
n03201208_54612,diningtable,Wooden diningtable surrounded by elegant chairs,Wooden diningtable with eight carved chairs,0.2894159,0.34721226,0.25484848,0.9537175
2009_001457,horse,Horse standing on a green grassy field,White horse with halter against gray wall,0.2882086,0.31920645,0.07633347,0.8764152
2009_001853,train,Train at station with tracks and platform,Freight train passing by a station platform,0.29399067,0.33724827,0.1756301,0.90335476
n03201208_45174,diningtable,Diningtable with fruit bowl near window,Diningtable with fruit bowl near window,0.3397621,0.3397621,0.14763272,1.0
2010_005376,horse,Horse wearing halter near snowy wooden fence,Three horses grazing and resting near trees,0.25633603,0.29127198,0.059161346,0.88720304
2010_001659,dog,Dog running on wet sandy beach,Dog running on wet sandy beach,0.32301107,0.32301107,0.15897721,1.0
n11939491_14934,flower,Dried flower with curled petals on metal,White and yellow flower on wooden surface,0.30157486,0.30948743,0.18046108,0.8885747
2008_002458,person,Person smiling with child by a fence,Person sitting on bench with child outdoors,0.27118698,0.27173358,0.14234805,0.9260587
n04344873_12044,sofa,Pink sofa with a matching canopy cover,Sofa with pillows beside a lamp and dresser,0.2715628,0.27230498,0.106709234,0.8812391
n04344873_3949,sofa,Wooden sofa with decorative backrest design,Wooden sofa with decorative backrest design,0.32069543,0.32069543,0.24630737,1.0
n02791124_257,chair,Vintage chair with metal frame by windows,Barber chair with brown leather and wood,0.30555207,0.37647235,0.18979052,0.89557713
n03792782_4222,bicycle,Black bicycle with red tires on pavement,Black mountain bicycle indoors on red tile floor,0.3001365,0.31784028,0.10312487,0.9036679
005171,boat,Boat sailing near coastal hills and mountains,Large boat docked near a calm shore,0.26412892,0.2808488,0.16959105,0.90877515
n02410509_771,cow,Cow herd walking along forest road,Cow herd walking along forest road,0.2566377,0.2566377,0.13287035,0.99999994
2011_000457,sofa,Floral patterned sofa with colorful upholstery,Floral patterned sofa with colorful upholstery,0.2971171,0.2971171,0.15613459,1.0
004045,sofa,Beige sofa near table and green plant,Beige sofa with dark wooden armrests,0.31059596,0.3318841,0.19463232,0.9031333
n11939491_5379,flower,White flower with yellow center among grass,White daisy flower with green foliage,0.311109,0.35479057,0.08095934,0.9028284
n02408429_1388,cow,Cow grazing in tall green grass,Cow resting on grass beneath another cow,0.28371507,0.3125483,0.14435717,0.90816313
n03376595_8398,chair,Wooden chair on a hardwood floor,Wooden chair on a hardwood floor,0.32138726,0.32138726,0.088225186,1.0
007033,aeroplane,Aeroplane on wet runway near grass field,Silver aeroplane displayed on outdoor tarmac,0.25066516,0.29100996,0.12977508,0.90224946
n11939491_5584,flower,Yellow flower bloom against a dark backdrop,Yellow flower with green and brown center,0.29030833,0.30802143,0.15072961,0.884271
2009_004579,bottle,Tall sake bottle with floral label nearby box,Tall sake bottle with floral label nearby box,0.32756898,0.32756898,0.18427345,1.0
n11939491_9525,flower,White flower surrounded by green leaves,White daisy flower with green foliage,0.306625,0.35260677,0.13132392,0.94267774
n02389026_218,horse,Horse standing in tall grassy field,Young horse running on sandy paddock grass,0.29431957,0.33044368,0.1711493,0.9138574
n03201208_15246,diningtable,Glass diningtable surrounded by wooden chairs,Glass diningtable with four cushioned chairs nearby,0.30355763,0.32928377,0.16207418,0.9415653
n11939491_8902,flower,White daisy flower surrounded by green grass,White daisy flower surrounded by green grass,0.34059355,0.34059355,0.14218555,1.0
003514,bird,White bird perched beside green bird indoors,White bird perched beside green bird indoors,0.3071018,0.3071018,0.28384086,1.0
n03782006_2624,tvmonitor,tvmonitor displaying code beside a laptop,Two tvmonitor screens on a cluttered desk,0.27530834,0.30233276,0.15111507,0.88396525
2010_000557,bicycle,Bicycle with orange pannier on wooden floor,Bicycle with orange pannier on wooden floor,0.3631407,0.3631407,0.09373604,1.0
000198,train,Vintage train on curved rural railway tracks,Passenger train approaching through forested tracks,0.29297093,0.32034075,0.15495363,0.8964946
008370,bird,Colorful bird standing on a wooden branch,Colorful bird standing on a wooden branch,0.3407114,0.3407114,0.088207334,1.0
2010_002853,person,Person smiling inside an airplane cockpit,Person smiling inside an airplane cockpit,0.31908756,0.31908756,0.102596134,1.0
005066,bus,Tourist bus parked near tall green trees,Tourist bus parked near tall green trees,0.29415694,0.29415694,0.12066727,1.0
n04099969_4902,chair,Wicker rocking chair on patterned carpet,Wicker rocking chair on a garden patio,0.33731705,0.3426787,0.23739274,0.93707407
004025,bird,Black bird standing on grassy ground,Black bird standing on grassy ground,0.31999046,0.31999046,0.108870946,1.0000001
2009_001390,aeroplane,Aeroplane parked on airport tarmac,Silver aeroplane displayed on outdoor tarmac,0.27640435,0.3092032,0.09812945,0.9210861
n04099969_2758,chair,Yellow chair on a wooden deck outdoors,Yellow chair on a wooden deck outdoors,0.3309145,0.3309145,0.12971205,1.0
2008_007415,chair,Floral upholstered chair beside a flower vase,Two patterned chairs on a carpeted floor,0.3271437,0.33197844,0.12825085,0.8796335
n04152593_25630,tvmonitor,Tvmonitor displaying a forest scene above keyboard,Old Compaq tvmonitor displaying Mac OS X,0.34540644,0.3533975,0.17387861,0.8610935
2008_005977,cat,Cat lounging on a wooden ledge,Tabby cat sitting on wooden floor,0.29496247,0.2961973,0.17378083,0.923852
n02410509_1538,cow,Cow grazing on dry ground near trees,Brown horse standing on muddy ground,0.26189655,0.30726343,0.19709224,0.9110894
n03376595_9800,chair,Beige folding chair on carpeted floor,Beige folding chair on carpeted floor,0.34788287,0.34788287,0.21653783,1.0
n03201208_45974,diningtable,Large wooden diningtable surrounded by wooden chairs,Large wooden diningtable with matching chairs,0.2746609,0.30366883,0.15077955,0.9621248
2008_008636,dog,Dog standing alert on green grass,Dog standing on a grassy field,0.284689,0.3039373,0.17923203,0.9501213
006694,train,Steam train behind a stone wall,Steam train behind a stone wall,0.32044172,0.32044172,0.15415557,1.0
2008_004427,dog,Fluffy dog standing on wet sidewalk,Fluffy dog standing on wet sidewalk,0.36194873,0.36194873,0.14788896,1.0
2008_003287,person,Person walking through a forest of tall trees,Person walking through a forest of tall trees,0.30400938,0.30400938,0.08817126,1.0
n02422699_4345,sheep,Sheep standing alert in dry grassy field,Brown horse standing in a fenced enclosure,0.21595109,0.2625632,0.17985949,0.8897242
n04099969_1805,chair,Wooden chair with cushion on patterned cloth,Wooden chair with cushion on patterned cloth,0.35288393,0.35288393,0.15349102,1.0
n03983396_4605,bottle,Red lemonade bottle on a grocery shelf,Red lemonade bottle on a grocery shelf,0.30445603,0.30445603,0.11852504,1.0
001863,car,Rally car racing on a dirt track,Rally car speeding on a dirt track,0.2921386,0.30125058,0.096472554,0.9787226
2008_002677,person,Two people dressed formally beside a brick wall,Two people dressed formally beside a brick wall,0.31279004,0.31279004,0.12429808,1.0
n02389026_9888,horse,Horse standing near a wooden fence,Brown horse standing in a fenced enclosure,0.2868693,0.31081125,0.17742616,0.9349278
2009_003185,train,Train passing by trees and power lines,Train covered in bold silver graffiti artwork,0.24240693,0.2918192,0.12572466,0.8677535
2008_003015,person,Person sitting indoors near a window,Person with dark hair against a white wall,0.25905782,0.265184,0.16913131,0.89198166
n02835271_1055,bicycle,Tandem bicycle parked beside green bushes,Bicycle with yellow rims on a red mat,0.298799,0.31429416,0.1559057,0.877428
n02422699_38516,sheep,Sheep grazing on green grassy field,Three horses grazing in a grassy field,0.20873335,0.24456936,0.109494165,0.95701474
000182,person,Person sitting on a tan leather couch,Person sleeping on a couch with blankets,0.21333559,0.23788667,0.15126446,0.93514866
004278,aeroplane,Aeroplane on display beside modern building,Silver aeroplane displayed on outdoor tarmac,0.3088759,0.32270098,0.13215172,0.91646254
005924,car,Boxy car with open doors at auto show,Boxy car with open doors at auto show,0.33617413,0.33617413,0.17948529,1.0
007717,bottle,Wine bottle on a wooden table,A wine bottle on a white table,0.2662517,0.27768457,0.15998533,0.9627508
n03792782_6159,bicycle,Red bicycle leaning against a white wall,Bicycle with yellow rims on a red mat,0.284826,0.31370908,0.13640384,0.8885199
006294,aeroplane,Aeroplane on runway with grassy field,Aeroplane taxiing on green grass runway,0.27846682,0.28290805,0.08146824,0.9488852
n02389026_15566,horse,Horse resting peacefully on green grass,Horse resting peacefully on green grass,0.32486275,0.32486275,0.1527425,1.0
002891,train,Green steam train traveling through lush countryside,Black train engine on gravel railway tracks,0.28860188,0.31065056,0.20020641,0.88592535
2008_005272,dog,Dog in colorful costume on pavement,Dog in colorful costume on pavement,0.31444255,0.31444255,0.10949299,1.0
2008_001070,dog,Dog on leash sitting near stone ledge,Dog on leash sitting near stone ledge,0.30123734,0.30123734,0.17452127,1.0
001694,cat,Cat resting on a green chair,Cat sitting on a windowsill indoors,0.2933481,0.2977566,0.18619561,0.9228059
001542,cat,Tabby cat resting on a red couch,Tabby cat resting on a red couch,0.33500794,0.33500794,0.0790133,1.0
n02422106_3940,sheep,Sheep standing on dry grassy field,Three horses grazing and resting near trees,0.16855764,0.26862115,0.12441586,0.89367557
009305,bicycle,Bicycle parked beside a white wall,Tandem bicycle against a plain white wall,0.33568436,0.34120178,0.24641733,0.9358334
2011_000012,train,Freight train moving through snowy forest tracks,Canadian train stopped near a forested area,0.31222552,0.32001817,0.16587473,0.9044503
n02835271_5785,bicycle,Tandem bicycle parked beside a tree,Tandem bicycle on a gravel surface,0.33739775,0.33892065,0.19954099,0.9441009
n02415577_2177,sheep,Sheep standing on a rocky hillside,Sheep standing among large gray rocks,0.29976258,0.31223136,0.17107838,0.93229574
n04099969_72,chair,Wooden chair on carpeted living room floor,Wooden rocking chair on hardwood floor,0.30243903,0.30969054,0.23998728,0.9327229
000844,car,Race car speeding on a winding track,Race car speeding on a racetrack,0.2562979,0.2600638,0.13644989,0.96282446
n03095699_138,boat,Boat carrying containers near a large bridge,Large container boat passing near city shoreline,0.28292698,0.308147,0.15402527,0.91495776
n02408429_12562,cow,Cow standing on dry grassy plain,Sheep with large horns on rocky terrain,0.2842141,0.30209088,0.13983431,0.8878716
n03201208_2588,diningtable,Wooden diningtable with four cushioned chairs,Round diningtable with four wooden chairs,0.32942832,0.3377742,0.10702263,0.953793
009226,tvmonitor,tvmonitor on desk with keyboard and book,Two tvmonitor screens on a cluttered desk,0.29292274,0.29742864,0.093668036,0.90538985
n02408429_10342,cow,Cow standing in a muddy grassy field,Cow grazing among tall green grass,0.2785724,0.29265243,0.20026447,0.9106621
n04487081_27439,bus,Bus turning on a street near tall trees,Two city buses on a sunny street,0.28701687,0.29192436,0.13234326,0.9104258
n04487081_13159,bus,Bus turning on a quiet suburban street,Bus parked on a paved street plaza,0.29357052,0.30475235,0.22353013,0.92014974
n02422699_6507,sheep,Sheep grazing near thorny bushes,Two horses play on grassy field,0.24199873,0.264386,0.15124418,0.89179486
2008_004480,dog,Dog lying on a plaid bedspread,Dog lying on a plaid bedspread,0.3450267,0.3450267,0.12055074,1.0
n03782006_40413,tvmonitor,tvmonitor floating partially submerged in water,tvmonitor floating partially submerged in water,0.32756072,0.32756072,0.1770533,1.0000001
000469,car,Old green car parked on snowy ground,Old green car parked on snowy ground,0.34221518,0.34221518,0.18429777,1.0
2008_007947,car,Blue rally car displayed on showroom floor,Blue rally car displayed on showroom floor,0.32373405,0.32373405,0.12000467,1.0
002292,bicycle,Bicycle parked by a weathered metal door,Bicycle parked by a weathered metal door,0.33984447,0.33984447,0.13945785,1.0
2010_005005,person,Two people sitting together on a bus,Two people sitting together on a bus,0.2926453,0.2926453,0.11264636,1.0000001
n04099969_2610,chair,Wooden chair with carved backrest among others,Wooden chair with carved backrest among others,0.30793002,0.30793002,0.13796079,1.0
004871,train,Maroon train traveling on city railway tracks,Maroon train traveling on city railway tracks,0.32761583,0.32761583,0.14446704,1.0
008851,tvmonitor,Tvmonitor on a cluttered computer desk,Two tvmonitor screens on a cluttered desk,0.30932218,0.32335073,0.14499752,0.95400184
n03983396_9776,bottle,Colorful bottle sculptures displayed in an art gallery,Colorful bottle sculptures displayed in an art gallery,0.32874042,0.32874042,0.09324894,1.0
n03785016_25207,motorbike,Red motorbike parked on sunny pavement,Red motorbike parked beside a sidewalk,0.28647047,0.30307078,0.12923414,0.9543649
008116,sheep,Sheep grazing and standing on green field,Two sheep standing on grassy ground,0.30215746,0.31436396,0.099741556,0.9278735
2010_002876,cat,Cat sleeping on a pink polka dot blanket,Cat sleeping on a pink polka dot blanket,0.31609347,0.31609347,0.0834839,1.0
009191,motorbike,Motorbike parked on a rural paved road,Motorbike parked on a rural paved road,0.27666458,0.27666458,0.1203036,1.0
n04344873_3022,sofa,Rustic wooden sofa with striped bedding,Rustic wooden sofa with striped bedding,0.27649695,0.27649695,0.13430442,1.0
n02412080_21153,sheep,Sheep standing in tall grassy field,Sheep with curled horns standing on grass,0.3138844,0.32513672,0.12039864,0.9306241
2010_003385,car,Car on display under bright lights,Futuristic car with open gullwing door display,0.2702611,0.27140474,0.111582935,0.85352004
2008_002767,dog,Dog lying on carpet near wall,Dog with a green collar indoors,0.26878592,0.28104138,0.110778764,0.88597983
n03201208_6498,diningtable,Elegant diningtable set in a vintage room,Diningtable with polka dot cloth and chairs,0.25844455,0.30913833,0.17301014,0.88238186
2008_001344,person,Person smiling beside a kitchen counter,Person smiling beside a kitchen counter,0.2993939,0.2993939,0.14278041,0.99999994
2008_004973,bird,Bird gliding on calm blue water,Black bird swimming on calm water,0.2559017,0.2869771,0.11812889,0.9475214
n03062245_2115,bottle,Red glass bottle with silver metal lid,Red glass bottle with silver metal lid,0.32482836,0.32482836,0.2206606,0.99999994
n03983396_5611,bottle,Bottle of Fanta and Coca-Cola on table,Bottle of soda among other glass bottles,0.26847756,0.3093611,0.078172706,0.90472937
n04344873_16444,sofa,Gray sofa near kitchen and colorful painting,Gray sofa near kitchen and colorful painting,0.33885342,0.33885342,0.22614902,1.0000001
n04099969_21118,chair,Wooden rocking chair with blue cushion upholstery,Wooden rocking chair with blue cushion upholstery,0.33202246,0.33202246,0.124242656,1.0
2008_000775,person,Person sleeping on a couch with blankets,Person feeding baby with orange food,0.231179,0.26684898,0.10646671,0.90162945
n03782006_8136,tvmonitor,tvmonitor on a cluttered wooden desk setup,Dual tvmonitor screens on a computer desk,0.2950333,0.29628438,0.1411629,0.89741504
007211,motorbike,Motorbike parked on mountain roadside,Motorbike parked on mountain roadside,0.29159662,0.29159662,0.18171093,0.99999994
