image_name,category,true_caption,retrieved_caption,CLIPScore_matched,CLIPScore_retrieved,CLIPScore_random,BERTScore_F1
002916,person,Person standing beside tall floor lamp,Person standing beside tall floor lamp,0.32330883,0.32330883,0.12213643,1.0
2010_001647,cat,Orange cat lying on dry grass,Orange cat lying on dry grass,0.352701,0.352701,0.13779947,1.0
n03095699_471,boat,Boat carrying containers sailing on open water,Boat carrying containers sailing on open water,0.3185571,0.3185571,0.1547849,0.9999999
n02389026_27212,horse,Horse running on grassy field near houses,Horse and foal standing on grassy yard,0.28885907,0.29418483,0.16598168,0.9344646
n03983396_2242,bottle,Bottle of soda among other glass bottles,Bottle of soda among other glass bottles,0.2965372,0.2965372,0.08157167,1.0
n04344873_16080,sofa,Sofa with green leaf pillows beside table,Marble diningtable with white chairs and tiles,0.27392912,0.2758662,0.1090626,0.8673756
n03785016_8099,motorbike,Red motorbike parked on green grass,Red motorbike parked on a paved walkway,0.27145666,0.2970994,0.08781732,0.95563185
n02389026_3305,horse,Young horse walking on green grassy field,Young horse foal trotting on green grass,0.2461279,0.28382966,0.099117935,0.94181776
2008_008583,train,Canadian train stopped near a forested area,Canadian train stopped near a forested area,0.3264736,0.3264736,0.16109367,1.0
n03095699_10446,boat,Boat carrying colorful shipping containers on water,Container boat loaded with cargo at sea,0.2991705,0.3158652,0.18035325,0.90517956
n11939491_4544,flower,Purple flower standing out against green grass,Purple flower with green blurred surroundings,0.30913797,0.3156237,0.13844739,0.92173743
n04099969_1636,chair,Wooden rocking chair with a colorful blanket,Wooden rocking chair with a colorful blanket,0.31667215,0.31667215,0.11736968,1.0
n02408429_5761,cow,Group of black cows standing on grass,Group of black cows standing on grass,0.33606955,0.33606955,0.20586056,1.0
2009_005232,aeroplane,Vintage aeroplane displayed inside a museum,Aeroplane displayed in a large hangar,0.31858855,0.3409397,0.10139713,0.9352112
2010_001522,sheep,Sheep standing on grassy hill near tree,Sheep standing on grassy hill near tree,0.32581893,0.32581893,0.12829718,1.0
2011_000454,sheep,Sheep grazing on a green hillside pasture,Sheep grazing on a green hillside pasture,0.32793522,0.32793522,0.13828179,1.0
000645,bird,Yellow bird perched on a cage branch,Yellow bird perched on a cage branch,0.30755576,0.30755576,0.09580088,1.0
005013,train,Red and cream train at rural station platform,Red double-decker train at a modern station,0.29448706,0.3003504,0.13800916,0.90161574
n04344873_16831,sofa,Plaid sofa with mismatched cushions on wood floor,Plaid sofa with mismatched cushions on wood floor,0.35430378,0.35430378,0.13552716,1.0
n03782006_15046,tvmonitor,Vintage tvmonitor displaying green text interface,Vintage tvmonitor displaying green text interface,0.35313907,0.35313907,0.17398702,1.0
n04344873_17545,sofa,Rustic wooden sofa with green cover,Sofa with green leaf pillows beside table,0.29302078,0.3013296,0.106065795,0.88814354
n04152593_6384,tvmonitor,Broken tvmonitor smashed with a hammer outdoor,Broken tvmonitor smashed with a hammer outdoor,0.31552964,0.31552964,0.13697037,1.0
2008_005303,bird,Bird perched on a wooden post outdoors,Bird perched on a wooden post outdoors,0.27632987,0.27632987,0.18190125,1.0000001
n02417914_26,sheep,Sheep standing on rocky grassy hillside,Sheep with large horns on rocky terrain,0.2659653,0.29833522,0.14953049,0.92092633
n03983396_24815,bottle,Root beer bottle against a brick wall,Root beer bottle against a brick wall,0.3425573,0.3425573,0.12900428,1.0
007933,bicycle,Bicycle with yellow accents near brick wall,Yellow tandem bicycle against a brick wall,0.32519552,0.32805938,0.13705315,0.92554766
2008_003827,motorbike,Red Coca-Cola motorbike on a shiny platform,Red Coca-Cola motorbike on a shiny platform,0.3575076,0.3575076,0.07273157,1.0
2009_004334,bird,Bird flying near tree branches at dusk,Bird flying near tree branches at dusk,0.3076633,0.3076633,0.1358296,1.0
2011_001414,cat,Cat resting on a brown leather couch,Cat resting on a brown leather couch,0.30880746,0.30880746,0.1279678,1.0
2009_005102,dog,Dog standing on tiled floor near wooden doors,Dog in a sweater standing on table,0.27033198,0.28457975,0.20212796,0.90484023
n03201208_29131,diningtable,Wood diningtable with striped cushioned chairs,Diningtable with four chairs on wood floor,0.2999682,0.3227466,0.18140003,0.9137404
2009_002499,cat,Cat with closed eyes under indoor lights,Cat face close-up with long whiskers,0.27436692,0.27984822,0.15968147,0.88479936
008684,car,Race car speeding on a racetrack,Race car speeding on a winding track,0.27385896,0.27512926,0.12230789,0.96282446
n03095699_5951,boat,Boat carrying containers on calm ocean water,Boat carrying cargo containers on open water,0.31341022,0.32631424,0.14880306,0.9587206
n04487081_1702,bus,Bus driving on a city street downtown,Bus parked on city street near buildings,0.3258464,0.34265083,0.16439569,0.93071187
n03095699_18715,boat,Boat carrying shipping containers on open water,Container boat carrying cargo on calm water,0.28810418,0.30276132,0.30182695,0.9331561
001126,aeroplane,Aeroplane flying high in clear sky,Aeroplane flying low over residential area,0.27886316,0.28115213,0.09517129,0.9408733
2010_000036,car,Black car parked near palm trees,Black car parked near palm trees,0.27181575,0.27181575,0.13897069,1.0
n03782006_9891,tvmonitor,tvmonitor and keyboard on a wooden desk,Old Compaq tvmonitor displaying Mac OS X,0.31275308,0.34801728,0.12224674,0.8667128
2011_001964,bus,Bus parked on a paved street plaza,Bus turning near decorative archway structure,0.29914892,0.31083,0.20391376,0.8919206
004312,sheep,Sheep standing on dry grass and dirt,Sheep with curled horns standing on grass,0.2826652,0.3023598,0.24164382,0.9296477
2009_003523,tvmonitor,tvmonitor displaying error screen on airplane seat,tvmonitor displaying error screen on airplane seat,0.3619545,0.3619545,0.29982334,1.0000001
004425,bird,Colorful bird perched on a tree branch,Colorful bird standing on a wooden branch,0.30796853,0.30964786,0.124871105,0.9641283
n03782006_32434,tvmonitor,Dual tvmonitor setup on wooden computer desk,Dual tvmonitor screens on a computer desk,0.28481352,0.33007386,0.23349695,0.95704013
008266,train,Vintage train passing through a green area,Maroon train traveling on city railway tracks,0.2721939,0.29488122,0.16549742,0.90446234
2010_001327,sofa,Floral patterned sofa with plush cushions,Sofa with green leaf pillows beside table,0.31181923,0.32621288,0.17352888,0.8797414
2008_008541,cow,Cow standing near a wire fence enclosure,Cow standing near a wire fence enclosure,0.34030157,0.34030157,0.10968395,1.0
2010_001356,sheep,Sheep standing on snow-covered ground,Sheep standing on snow-covered ground,0.30044013,0.30044013,0.1320535,1.0
n04344873_5908,sofa,Orange sofa with pillows against yellow wall,Orange sofa with pillows against yellow wall,0.32612276,0.32612276,0.106734134,1.0
n11939491_9245,flower,White daisy flower surrounded by green leaves,White daisy flower with green foliage,0.33178675,0.3408156,0.16810775,0.97050995
007973,aeroplane,Aeroplane flying above clear blue ocean,Aeroplane flying above clear blue ocean,0.253068,0.253068,0.10205714,1.0
n03785016_10909,motorbike,Red and silver motorbike on a white surface,Red and silver motorbike on a white surface,0.29509467,0.29509467,0.21440119,1.0
n03201208_46701,diningtable,Wooden diningtable with six matching chairs,Wooden diningtable with four cushioned chairs,0.33445725,0.33546856,0.1033098,0.96233994
000179,boat,Boat with tall sails on open water,Boat with tall masts sailing on ocean,0.27065882,0.27900153,0.1265357,0.93701434
n02791124_696,chair,Brown chair on a tiled kitchen floor,Barber chair with brown leather and wood,0.2837901,0.36606026,0.120509595,0.8828687
2008_006889,motorbike,Green motorbike parked on concrete driveway,Tandem bicycle with bottles on display wall,0.29736692,0.3213182,0.16469678,0.8904274
2011_001354,cow,Cow resting on green grass near rocks,Cow resting on grass near a lake,0.33037615,0.3336469,0.16786316,0.9615463
n03201208_10572,diningtable,Wooden diningtable with chairs and cushioned bench,Diningtable with six chairs near large curtains,0.29306686,0.32267672,0.109418094,0.909332
2008_002988,person,Person sitting on floral patterned couch,Person sitting on floral patterned couch,0.25384128,0.25384128,0.14215502,1.0
n03201208_26924,diningtable,Round diningtable with four green chairs nearby,Round diningtable with four green chairs nearby,0.34169853,0.34169853,0.12455738,1.0
n04483307_2684,boat,Sailboat gliding on calm blue water,Boat with tall sails on open water,0.29768175,0.31294864,0.1095593,0.9088012
000075,dog,Dog running through sunlit grassy field,Dog running through sunlit grassy field,0.32127893,0.32127893,0.18357839,1.0
n04487081_11955,bus,Bus turning near decorative archway structure,Bus parked on a paved street plaza,0.30184087,0.30244833,0.09774554,0.8919206
2009_003735,dog,Dog sitting on bright green grass,Dog running through sunlit grassy field,0.30042082,0.31842443,0.12828979,0.9156802
2010_003774,sheep,Sheep with curled horns standing on grass,Sheep standing together near a metal fence,0.28842962,0.30527997,0.06689289,0.91087556
2008_008711,bicycle,Bicycle parked beside a metal railing,Black bicycle on gray tiled floor,0.30201313,0.31211644,0.17163649,0.86513585
2009_002515,horse,Horse walking in a fenced paddock,Horse walking in a fenced grassy area,0.3316458,0.33210683,0.19033834,0.9657292
n02389026_1209,horse,Horse standing on grassy open field,Horse and foal standing on grassy yard,0.2576025,0.28960818,0.14251569,0.95401835
n03095699_4539,boat,Boat carrying containers on a wide river,Large container boat passing near city shoreline,0.30438644,0.3356504,0.16011888,0.8928674
n02410509_6719,cow,Cow standing on grassy fenced pasture,Brown horse standing in a fenced enclosure,0.28833967,0.29713863,0.17411059,0.9325921
001643,dog,Dog resting on a black futon couch,Dog resting on a black futon couch,0.33137226,0.33137226,0.15041634,1.0
n02835271_12544,bicycle,Tandem bicycle parked near a wooden fence,Tandem bicycle parked on suburban driveway,0.3166097,0.32040057,0.123420894,0.94346404
2009_003419,cat,Cat face close-up with long whiskers,Cat face close-up with long whiskers,0.2967943,0.2967943,0.1309672,1.0000001
n02423022_6392,sheep,Sheep standing on green grassy field,Sheep with large horns on rocky terrain,0.2063142,0.26555,0.0855204,0.9073909
2009_004129,chair,Blue chair on a wooden deck outdoors,Black folding chair on a wooden deck,0.30046144,0.30689093,0.17501315,0.9577876
2010_003077,dog,Dog with beaded collar on asphalt road,Dog with beaded collar on asphalt road,0.33884132,0.33884132,0.16118258,1.0
n02415577_14295,sheep,Sheep standing on a grassy hillside,Two sheep standing on grassy ground,0.27519643,0.31845427,0.17937966,0.95505404
n04099969_2545,chair,Wooden chair with airplane patterned cushion,Beige folding chair on carpeted floor,0.30221897,0.3412306,0.23766507,0.86852604
n11939491_7719,flower,White and yellow flower among pink petals,White and yellow flower among pink petals,0.3197861,0.3197861,0.13724919,1.0
2008_005728,dog,Dog rolling on green grassy field,Dog lying on green grass outdoors,0.30733874,0.3090009,0.14454241,0.9426852
2010_003240,cat,Gray cats playfully wrestling on soft carpet,Gray cats playfully wrestling on soft carpet,0.3326437,0.3326437,0.1527886,0.9999999
009869,person,Person wearing a colorful hat in car seat,Person wearing a colorful hat in car seat,0.29889178,0.29889178,0.13675238,1.0
n11939491_2617,flower,Two white flower daisies among green grass,Two white flower daisies among green grass,0.3529489,0.3529489,0.18950248,1.0
2010_003251,bicycle,Bicycle parked on a grassy park path,Bicycle resting on a forest trail,0.30259883,0.3079359,0.14152862,0.9510664
n03376595_14765,chair,Rusty chair by a wire fence outdoors,Rusty chair by a wire fence outdoors,0.30282056,0.30282056,0.15341833,1.0
n03201208_21641,diningtable,Diningtable with flowers and covered chairs,Diningtable with fruit bowl near window,0.2864944,0.3255009,0.23101144,0.91695356
2011_002396,train,Black steam train displayed on sunny grass,Black steam train displayed on sunny grass,0.3228743,0.3228743,0.17392284,1.0
n04344873_1901,sofa,Sofa with checkered cushions on rug,Rustic wooden sofa with striped bedding,0.21231797,0.2856484,0.14627558,0.8859686
n03095699_14621,boat,Boat carrying containers on open water,Boat carrying containers sailing on open water,0.29680187,0.30583403,0.14256015,0.9838756
006844,train,Black steam train displayed behind metal fence,Black steam train displayed behind metal fence,0.32403922,0.32403922,0.082307614,1.0
n03785016_24486,motorbike,Blue motorbike parked on green grass,Blue motorbike parked on green grass,0.3083083,0.3083083,0.2516782,1.0
001440,bird,Black bird swimming on calm water,Black bird swimming on calm water,0.29168767,0.29168767,0.13059077,1.0
n03095699_31813,boat,Large cargo boat carrying colorful shipping containers,Large container boat passing near city shoreline,0.3157577,0.32212123,0.10172492,0.89329404
n11939491_47178,flower,White flower reaching toward clear blue sky,White flower reaching toward clear blue sky,0.32459986,0.32459986,0.17798264,1.0
n04483307_7787,boat,"Sailboat on a calm, cloudy lake","Sailboat on a calm, cloudy lake",0.30647653,0.30647653,0.07246754,1.0
2008_005695,boat,Boat with tall masts sailing on ocean,Boat with tall sails on open water,0.30654243,0.31081134,0.14434355,0.93701434
2011_000269,bird,Bird standing on a stone pavement,Bird standing on a stone pavement,0.28798229,0.28798229,0.087950446,1.0
n03785016_15442,motorbike,Light blue motorbike parked near a lattice fence,Light blue motorbike parked near a lattice fence,0.29576045,0.29576045,0.18928067,1.0
004403,bird,Bird perched on a branch near water,Bird perched on a wooden branch,0.3010015,0.30391276,0.11925091,0.96197385
004388,train,Blue Pan Am Railways train beside building,Blue Pan Am Railways train beside building,0.30709693,0.30709693,0.08796783,1.0
n03983396_14364,bottle,Bottle lineup of colorful sodas in snow,Bottle lineup of colorful sodas in snow,0.30844185,0.30844185,0.09155691,1.0
n02835271_5418,bicycle,Tandem bicycle parked on suburban driveway,Tandem bicycle parked on suburban driveway,0.30999058,0.30999058,0.15371472,1.0
n03785016_7418,motorbike,Motorbike parked on a sunny city street,Two motorbikes parked outside a restaurant,0.27122173,0.289689,0.1755836,0.92305374
n02422699_2056,sheep,Sheep standing alone on grassy field,Bird standing on grassy ground near bushes,0.19517137,0.25298434,0.1853596,0.9343783
2009_004033,dog,Dog standing on rippled sand dunes,Dog standing on rippled sand dunes,0.34835505,0.34835505,0.17818588,0.9999999
2009_001397,bird,Bird standing by a blue swimming pool,Bird standing by a blue swimming pool,0.33731988,0.33731988,0.13357113,1.0
n03376595_2004,chair,Black folding chair on a wooden deck,Vintage chair with metal frame by windows,0.2984742,0.31659573,0.16109112,0.89440435
2011_002251,train,Steam train near a maintenance building,Black steam train displayed on sunny grass,0.31227076,0.32397568,0.14157219,0.89884603
2010_004145,horse,Horse with bridle under cloudy sky,Horse with bridle under cloudy sky,0.31729597,0.31729597,0.10507171,1.0
2008_003659,cat,Cat sitting by a sunny window,Gray cat indoors with tan walls,0.27064964,0.2932523,0.1483813,0.87986404
n02835271_14402,bicycle,Tandem bicycle parked beside a blue wall,Bicycle with orange pannier on wooden floor,0.28643313,0.32009035,0.122513354,0.884226
n03983396_5307,bottle,Vintage soda bottle collection on a wooden shelf,Vintage soda bottle collection on a wooden shelf,0.37182385,0.37182385,0.10165419,1.0
n03785016_1113,motorbike,Red motorbike parked on quiet roadside grass,Red motorbike parked on quiet roadside grass,0.30132648,0.30132648,0.12228458,0.99999994
n02389026_8638,horse,Horse and foal walking on grassy field,Horse and foal standing on grassy yard,0.29136074,0.29994166,0.09316482,0.9775748
2009_004867,bus,City bus parked by trees and sidewalk,Bus parked on a paved street plaza,0.2803364,0.30189145,0.112772085,0.91965055
2010_002030,bicycle,Bicycle leaning against a white wall indoors,Black bicycle on gray tiled floor,0.2803476,0.30755195,0.08977006,0.8744927
005202,bird,Bird with red head on tiled ground,Bird with red head on tiled ground,0.3381612,0.3381612,0.104137875,1.0
2009_000828,boat,Boat floating on calm blue water,Boat with tall sails on open water,0.24598324,0.270718,0.22264913,0.918373
2010_004357,aeroplane,Aeroplane flying in a clear sky,Aeroplane taxiing near large airport hangar,0.26658243,0.27270928,0.078982964,0.9226203
006252,dog,Brown dog lying on tiled floor,Fluffy dog standing on wet sidewalk,0.28714412,0.2887483,0.12032862,0.9116182
n02835271_23683,bicycle,Blue tandem bicycle on green grass lawn,Blue tandem bicycle on green grass lawn,0.31842554,0.31842554,0.10167336,1.0
n04483307_11047,boat,Sailing boat gliding on open water,Boat with tall sails on open water,0.29384735,0.30195695,0.10128,0.931546
n03983396_12030,bottle,Bottle assortment on a wooden table,Bottle of soda among other glass bottles,0.23529074,0.29190302,0.1286532,0.8643367
n02389026_10498,horse,Brown horse standing in a fenced enclosure,Brown horse standing in a fenced enclosure,0.31968665,0.31968665,0.16259721,1.0
n03376595_6586,chair,Two cushioned chairs on a stone patio,Two cushioned chairs on a stone patio,0.3160664,0.3160664,0.1387227,1.0
n04152593_44675,tvmonitor,Old tvmonitor on a cluttered desk,tvmonitor on a desk with keyboard and computer,0.30573022,0.34229356,0.12614354,0.9104103
003262,bottle,Bottle of honey on a rustic windowsill,Bottle of honey on a rustic windowsill,0.38006073,0.38006073,0.16879663,1.0
2010_001838,dog,Dog standing on a wooden porch deck,Dog standing on a wooden porch deck,0.2833649,0.2833649,0.09989701,1.0
2010_003300,dog,Two dogs meeting on a dirt path,Two dogs meeting on a dirt path,0.30237713,0.30237713,0.1998241,1.0
2008_008377,bird,Bird standing alone on grassy field,Bird standing on grassy ground near bushes,0.29203302,0.30427176,0.10582125,0.9540503
n03376595_4978,chair,Wooden chair among patio tables outside,Wooden chair among patio tables outside,0.30490768,0.30490768,0.09215417,1.0000001
2008_001479,dog,Brown dog sitting on wooden floor,Brown dog sitting on wooden floor,0.29093328,0.29093328,0.12731764,1.0
002599,motorbike,Red and white motorbike parked near trees,White motorbike on display at an event,0.27451053,0.29391295,0.17309746,0.92308927
2009_001562,cat,Gray cat lounging on a purple couch,Gray cat lounging on a purple couch,0.32109928,0.32109928,0.22004884,1.0
n02835271_6752,bicycle,Blue tandem bicycle against a white sheet,Blue tandem bicycle against a white sheet,0.34776676,0.34776676,0.16651037,1.0
n02835271_31431,bicycle,Tandem bicycle parked on brick sidewalk,Tandem bicycle parked near a brick building,0.32238707,0.33262163,0.22094761,0.9629355
n02835271_323,bicycle,Tandem bicycle on a concrete driveway,Tandem bicycle parked on suburban driveway,0.29633507,0.31303504,0.16034952,0.9484004
2011_000283,train,Blue train arriving at city station tracks,Freight train passing by a station platform,0.26849708,0.2879831,0.15254457,0.90606886
n11939491_9282,flower,White flower blooming above green leaves,White daisy flower with green foliage,0.26215383,0.32389194,0.15026486,0.92008317
n04487081_14355,bus,Bus waiting at a city bus stop,Bus turning on a quiet suburban street,0.28962457,0.2973438,0.1775944,0.9095035
2008_005962,tvmonitor,Large tvmonitor sits on wooden dresser,Old Compaq tvmonitor displaying Mac OS X,0.33039236,0.33990756,0.17775384,0.8584133
2010_004559,bird,Bird eating from a person's hand outdoors,Bird eating from a person's hand outdoors,0.30002338,0.30002338,0.13261381,1.0
n02408429_8646,cow,Cow grazing in tall dry grass field,Group of black cows standing on grass,0.2584198,0.26575977,0.12251773,0.9060689
n11939491_45661,flower,White daisy flower surrounded by green leaves,White daisy flower surrounded by green grass,0.3319465,0.34078392,0.12915409,0.9731687
n04487081_13902,bus,Bus driving downtown near tall office buildings,Bus parked on city street near buildings,0.2862323,0.31166476,0.18308298,0.9162445
n02835271_1031,bicycle,Tandem bicycle parked beside a wooden fence,Tandem bicycle parked on a porch,0.31323296,0.33315337,0.183023,0.9631474
n11939491_9659,flower,Purple flower blooming amid green leafy plants,Purple and white flower with green leaves,0.30647686,0.33623403,0.12961732,0.9196633
n03201208_19579,diningtable,Glass diningtable with four cushioned chairs nearby,Glass diningtable with four cushioned chairs nearby,0.32704747,0.32704747,0.13452552,1.0
n03792782_42773,bicycle,Bicycle parked on a paved sidewalk,Bicycle with blue handlebars near garage doors,0.3013621,0.3092966,0.19228177,0.90729094
2010_005323,car,White car parked under dramatic cloudy sky,White car parked under dramatic cloudy sky,0.27688682,0.27688682,0.13417804,1.0000001
002439,aeroplane,Silver aeroplane displayed on outdoor tarmac,Silver aeroplane displayed on outdoor tarmac,0.32834473,0.32834473,0.10401895,1.0
2009_002047,aeroplane,Aeroplane taxiing on airport runway grass nearby,Aeroplane being towed on airport runway,0.2812392,0.306066,0.2390993,0.9391214
000871,car,Black car parked on a gravel driveway,Black car parked on cobblestone driveway,0.24863817,0.25663286,0.21005826,0.9506318
n02408429_1526,cow,Cow standing on a path beside green field,Cow grazing on dry ground near trees,0.2755871,0.29281443,0.12141781,0.9173284
n11939491_26398,flower,White and yellow flower surrounded by grass,White daisy flower surrounded by green grass,0.32705528,0.3469814,0.09060294,0.9489707
n03983396_4074,bottle,Bottle collection displayed on a wooden shelf,Bottle of soda among other glass bottles,0.29455316,0.3146687,0.13012734,0.88512623
n03792782_9436,bicycle,Bicycle resting on rocky trail near hills,Bicycle resting on rocky trail near hills,0.2625985,0.2625985,0.13046868,0.99999994
2010_001607,sheep,Two sheep grazing on green grass,Two sheep grazing on green grass,0.32191235,0.32191235,0.11726025,1.0
n02389026_10430,horse,Horse and foal standing on grassy yard,Horse and foal standing on grassy yard,0.30383462,0.30383462,0.18497433,1.0
n03201208_28824,diningtable,Diningtable with metallic decor and wooden chairs,Wooden diningtable with glasses and plates,0.28964004,0.30477408,0.13738197,0.918143
2008_003519,cat,Cat sitting on a computer tower desk,Cat sitting on a computer tower desk,0.3183515,0.3183515,0.12295786,1.0
2010_001452,cat,Black cat sitting on carpet near magazines,Black cat sitting on carpet near magazines,0.32563585,0.32563585,0.1409933,1.0
n11939491_15682,flower,Yellow flower with green and brown center,Yellow flower with green and brown center,0.320498,0.320498,0.15927012,1.0
2010_000437,aeroplane,Red aeroplane parked on grassy field,Aeroplane on display near park benches,0.31230545,0.31714523,0.104544476,0.91285443
2008_002999,person,Person wearing festive sweater holding a drink,Person wearing festive sweater holding a drink,0.34013325,0.34013325,0.12485257,1.0
009360,car,Car parked on a dirt road by trees,Car parked on a dirt road by trees,0.31751505,0.31751505,0.15913276,1.0
2009_000817,aeroplane,Aeroplane flying against a clear blue sky,Aeroplane taxiing near large airport hangar,0.23965065,0.2531818,0.09014369,0.91419053
2010_004118,aeroplane,Aeroplane on display near park benches,Silver aeroplane displayed on outdoor tarmac,0.3250174,0.32770476,0.17451692,0.91622555
n02412080_691,sheep,Sheep standing and resting among tall trees,Sheep locking horns on dry grassy ground,0.28385568,0.3003201,0.19941556,0.88383836
000686,motorbike,Two motorbikes parked outside a restaurant,Two motorbikes parked outside a restaurant,0.30260733,0.30260733,0.16022965,1.0
n02423022_2728,sheep,Sheep grazing together on green grass,Young horse foal trotting on green grass,0.22520061,0.25802496,0.18074441,0.9151235
2008_001744,bottle,Bottle with pink label on dining table,Bottle with pink label on dining table,0.32895094,0.32895094,0.102451175,1.0
n03201208_44249,diningtable,Large diningtable with ornate wooden chairs,Large diningtable with ornate wooden chairs,0.3287927,0.3287927,0.15216443,1.0
2008_004453,sheep,Sheep with short wool in a pen,Sheep with short wool in a pen,0.29946604,0.29946604,0.1370165,1.0
2009_003771,cat,Gray cat sitting on a wooden table outdoors,Gray cat sitting on a wooden table outdoors,0.32116193,0.32116193,0.12669969,1.0
n04487081_1329,bus,Bus driving down a city street at night,White bus on city street near apartments,0.29396155,0.32548273,0.12301331,0.9215571
002217,aeroplane,Aeroplane squad flying together in clear sky,Aeroplane squad flying together in clear sky,0.2685489,0.2685489,0.099135384,1.0
009906,tvmonitor,Four tvmonitor screens on grassy roadside curb,Four tvmonitor screens on grassy roadside curb,0.36653984,0.36653984,0.15220319,0.99999994
n04152593_560,tvmonitor,tvmonitor displaying waveforms beside electronic equipment,tvmonitor displaying waveforms beside electronic equipment,0.2959594,0.2959594,0.13269037,0.9999999
n03376595_6409,chair,Wooden chair sitting on green grass outdoors,Wooden chair sitting on green grass outdoors,0.32952768,0.32952768,0.105831414,1.0
003878,car,Blue classic car parked on the street,Blue classic car parked on the street,0.27505985,0.27505985,0.17702684,0.99999994
n03785016_24598,motorbike,Red motorbike parked beside wooden fence,Red motorbike parked beside a sidewalk,0.28661284,0.297533,0.15058307,0.96667707
001442,cow,Cow standing under a blue sky,Cow standing near a wire fence enclosure,0.31611174,0.32623422,0.18785106,0.9089915
